{
  "$schema": "../course.schema.json",
  "version": 1,
  "id": "surgery",
  "label": "Surgery",
  "description": "Lecture-first surgical revision content.",
  "order": 1,
  "defaultSubject": "urology",
  "lectureCatalog": "../../lectures/catalog.json",
  "subjects": [
    {"id": "urology", "label": "Urology", "order": 1},
    {"id": "general", "label": "General Surgery", "order": 2},
    {"id": "git", "label": "GIT Surgery", "order": 3},
    {"id": "neurosurgery", "label": "Neurosurgery", "order": 4}
  ]
}
